{
  "schemaVersion": "planprice-exchange-rates/1",
  "base": "USD",
  "generatedAt": "2026-09-23T00:00:00Z",
  "quotes": [
    {
      "base": "USD",
      "quote": "CNY",
      "rate": "7.2",
      "direction": "quote_per_base",
      "asOf": "2026-09-23T00:00:00Z",
      "expiresAt": "2026-09-24T00:00:00Z",
      "sourceId": "fx_source_example",
      "evidenceDigest": "sha256:0000000000000000000000000000000000000000000000000000000000000000"
    }
  ]
}
